{
  "schema_version": "frontier.machine.health.v1",
  "deployment_id": "demo-mixed-blocker-propose-only",
  "checked_at": "2026-08-06T00:00:00Z",
  "layers": {
    "process": {
      "checks": [
        {
          "id": "process-heartbeat",
          "status": "pass",
          "critical": true,
          "observed_at": "2026-08-05T23:59:55Z",
          "stale_after_seconds": 60,
          "summary": "HTTP heartbeat responded."
        }
      ]
    },
    "scheduler": {
      "checks": [
        {
          "id": "queue-claim",
          "status": "pass",
          "critical": true,
          "observed_at": "2026-08-05T23:59:40Z",
          "stale_after_seconds": 120,
          "summary": "Due work was claimed."
        }
      ]
    },
    "execution": {
      "checks": [
        {
          "id": "provider-smoke",
          "status": "fail",
          "critical": true,
          "reason_code": "credit_exhausted",
          "observed_at": "2026-08-05T23:59:30Z",
          "stale_after_seconds": 300,
          "summary": "Provider-backed execution failed because account credit was exhausted."
        }
      ]
    },
    "governance": {
      "checks": [
        {
          "id": "verifier-freshness",
          "status": "unknown",
          "critical": true,
          "reason_code": "missing_verifier",
          "observed_at": "2026-08-05T23:59:20Z",
          "stale_after_seconds": 300,
          "summary": "Verifier evidence is missing."
        }
      ]
    }
  },
  "aggregate_policy": {
    "status": "fail_closed",
    "rule": "Execution blockers outrank propose-only governance gaps."
  }
}
