{
  "schema_version": "frontier.machine.health.v1",
  "deployment_id": "demo-degraded-optional-check",
  "checked_at": "2026-08-06T00:00:00Z",
  "layers": {
    "process": {
      "checks": [
        {
          "id": "process-heartbeat",
          "status": "pass",
          "critical": true,
          "observed_at": "2026-08-05T23:59:55Z",
          "stale_after_seconds": 60,
          "summary": "HTTP heartbeat responded."
        },
        {
          "id": "optional-dashboard-export",
          "status": "unknown",
          "critical": false,
          "observed_at": "2026-08-05T23:40:00Z",
          "stale_after_seconds": 300,
          "summary": "Optional dashboard exporter has no current result."
        }
      ]
    },
    "scheduler": {
      "checks": [
        {
          "id": "queue-claim",
          "status": "pass",
          "critical": true,
          "observed_at": "2026-08-05T23:59:40Z",
          "stale_after_seconds": 120,
          "summary": "Due work was claimed."
        }
      ]
    },
    "execution": {
      "checks": [
        {
          "id": "worker-smoke",
          "status": "pass",
          "critical": true,
          "observed_at": "2026-08-05T23:59:30Z",
          "stale_after_seconds": 300,
          "summary": "Worker smoke completed."
        }
      ]
    },
    "governance": {
      "checks": [
        {
          "id": "gate-deny",
          "status": "pass",
          "critical": true,
          "observed_at": "2026-08-05T23:59:20Z",
          "stale_after_seconds": 300,
          "summary": "Governance gate denied unauthorized mutation."
        }
      ]
    }
  },
  "aggregate_policy": {
    "status": "fail_closed",
    "rule": "Optional check failure degrades observability but does not block mutation while all critical prerequisites pass."
  }
}
